sen_id,derived_word,stem,suffix,non_words,sentence,int_area,inv_loc,stem_freq,whole_word_freq,lsa_score,condition,question,question_id,cor_response
155,camper,camp,er,balver,The young camper sat on the doorstep and waited to leave. ,3,"239, 354",2612,73,0.709842,high_lsa_high_freq,NA,FALSE,NA
156,remarkable,remark,able,rerolvable,It was remarkable to the scientist how much the birthrate had increased.,3,"186, 354",224,641,0.777872,high_lsa_high_freq,NA,FALSE,NA
157,enforcement,enforce,ment,engursement,Strict enforcement of the rules was put into place at the schoolhouse that year. ,2,"188, 354",86,339,0.517443,low_lsa_high_freq,Were the rules fairly relaxed at the schoolhouse?,TRUE,no
158,laziness,lazy,ness,fojiness,The room was a pigsty because of laziness and excuses. ,8,"630, 354",591,24,0.551664,low_lsa_low_freq,NA,FALSE,NA
159,inclination,incline,ion,inbliration,The slight inclination of the girl towards witchcraft made her parents worry. ,3,"256, 354",19,42,0.701626,high_lsa_low_freq,NA,FALSE,NA
160,politeness,polite,ness,salictness,The children exhibited politeness every weeknight at dinner.,4,"460, 354",711,29,0.519907,low_lsa_low_freq,NA,FALSE,NA
